{
  "id": "REL-004",
  "app_type": "traditional",
  "location": {
    "category": "application",
    "component": "checkout_service"
  },
  "concerns": ["reliability"],
  "classification": { "type": "flaky_test" },
  "evidence": [
    {
      "repetitions": 20,
      "failures": 3,
      "failure_pattern": "fails only under >15 concurrent requests"
    }
  ],
  "investigations": [
    "reran suite 20x at varying concurrency; failures only above 15 concurrent"
  ],
  "root_cause": {
    "status": "inconclusive",
    "explanation": "insufficient evidence to classify as application defect vs. test infrastructure limit"
  },
  "severity": "P2",
  "confidence": 0.6,
  "verification": { "status": "reproduced_intermittently" }
}
